<proxies xmlns="http://membrane-soa.org/schemas/proxies/v1/"
		 xmlns:xsi="http://www.w3.org/2001/XMLSchema-instance"
      	 xsi:schemaLocation="http://membrane-soa.org/schemas/proxies/v1/ http://membrane-soa.org/schemas/proxies/v1/proxies.xsd">

	<serviceProxy name="Balancer" port="8080">
		<balancer>
			<clusters>
				<cluster name="Default"> 
					<!-- In production replace this with your service nodes. -->					
					<node host="localhost" port="4000"/>
					<node host="localhost" port="4001"/>
					<node host="localhost" port="4002"/>
				</cluster>
			</clusters>
		</balancer>
	</serviceProxy>
	
	<!-- The mock nodes are only for testing. You can remove them in production. -->
	<serviceProxy name="Mock Node 1" port="4000">
		<counter name="Mock Node 1" />
	</serviceProxy>
	<serviceProxy name="Mock Node 2" port="4001">
		<counter name="Mock Node 2" />
	</serviceProxy>
	<serviceProxy name="Mock Node 3" port="4002">
		<counter name="Mock Node 3" />
	</serviceProxy>
	
	<serviceProxy name="Administration" port="9000">
		<adminConsole />
	</serviceProxy>
</proxies>
